Date,Category,Amount,Description,Name,Account Type
"2025-03-03","Bank Fees","16.00","Monthly Fee Business Adv Fundamentals","Monthly Fee Business Adv Fundamentals","Cash"
"2025-03-03","Mortgage","2008.48","US BANK HOME MTG DES:MTG PYMT ID:XXXXX46559 INDN:TROY NOWAK CO ID:XXXXX00022 WEB","US BANK HOME MTG DES:MTG PYMT ID:XXXXX46559 INDN:TROY NOWAK CO ID:XXXXX00022 WEB","Cash"
"2025-03-11","Rental Income","-3150.00","RentSpree Payout DES:RentSpree ID:ST-R8K9F3Q8P2Q3 INDN:REDS HOMES LLC CO ID:XXXXX65600 CCD","RentSpree Payout DES:RentSpree ID:ST-R8K9F3Q8P2Q3 INDN:REDS HOMES LLC CO ID:XXXXX65600 CCD","Cash"
"2025-03-18","Miscellaneous","629.00","""Zelle payment to same day repair inc for 'ac repair'; Conf# gza711ryc""","""Zelle payment to same day repair inc for 'ac repair'; Conf# gza711ryc""","Cash"
"2025-04-01","Mortgage","2008.48","US BANK HOME MTG DES:MTG PYMT ID:XXXXX46559 INDN:TROY NOWAK CO ID:XXXXX00022 WEB","US BANK HOME MTG DES:MTG PYMT ID:XXXXX46559 INDN:TROY NOWAK CO ID:XXXXX00022 WEB","Cash"
